{
  "type": "tool_result",
  "execution_id": "exec_003",
  "causation_request_id": "req_001",
  "conversation_id": "conv_001",
  "task_id": "task_001",
  "step_id": "step_002",
  "tool": "query_calendar",
  "status": "success",
  "executed_at": "2026-09-04T10:00:02+08:00",
  "queried_range": {
    "start": "2026-09-05T12:00:00+08:00",
    "end": "2026-09-05T18:00:00+08:00"
  },
  "fetched_at": "2026-09-04T10:00:02+08:00",
  "results": []
}
