{
  "type": "tool_result",
  "execution_id": "exec_003",
  "causation_request_id": "req_001",
  "conversation_id": "conv_001",
  "task_id": "task_001",
  "step_id": "step_002",
  "tool": "query_reminders",
  "status": "success",
  "executed_at": "2026-09-04T10:00:02+08:00",
  "query_scope": "all_incomplete",
  "fetched_at": "2026-09-04T10:00:02+08:00",
  "results": []
}
